{
    "$schema": "./screenplay_schema.json",
    "genre": "",
    "theme_or_message": "",
    "logline": "",
    "setting": "",
    "characters": [
        {
            "id": "char_001",
            "name": "",
            "the_dramatic_need": "",
            "motivations": [],
            "strengths": [],
            "weaknesses": [],
            "secrets": []
        }
    ],
    "locations": [
        {
            "id": "loc_001",
            "name": ""
        }
    ],
    "plot_points": [
        {
            "id": "plot_001",
            "content": ""
        }
    ],
    "beat_sheet": [
        {
            "id": "beat_001",
            "content": ""
        }
    ],
    "treatment": "",
    "scenes": [
        {
            "id": "scene_001",
            "time": "",
            "content_id": "",
            "summary": "",
            "dependencies": [],
            "inventory": []
        }
    ],
    "control_signal": {
        "status": "REJECTED",
        "feedback": "",
        "issue_severity": "BLOCKER",
        "target_scope": ""
    },
    "version": 1,
    "state": "DRAFTING",
    "metadata": {
        "critique_stats": {
            "current_attempt_count": 0,
            "current_stage": "",
            "history": {
                "logline": 0,
                "beat_sheet": 0
            }
        },
        "context_stack": {
            "open_loops": [],
            "current_location_id": "",
            "narrative_arc_summary": ""
        }
    },
    "stale_content_blocks": []
}